title,subtopic,relevant_content,discussion_date
Talk:Agricultural machinery industry,External links modified,"hello fellow wikipedians,  i have just modified {{plural4|one external link|4 external links}} on . please take a moment to review [ my edit]. if you have any questions, or need the bot to ignore the links, or the page altogether, please visit  for additional information. i made the following changes added {{tlx|dead link}} tag to  added archive  to  added {{tlx|dead link}} tag to  added archive  to  added archive  to  added archive  to   when you have finished reviewing my changes, please set the ''checked'' parameter below to '''true''' or '''failed''' to let others know (documentation at {{tlx|sourcecheck}}).  {{sourcecheck|checkedfalse}}  cheers.—",5/10/2016 18:38
Talk:Arms industry,Propaganda,"feels like a propaganda piece from . is this really all that can be said about a huge and strategically important industry, that some people get killed with ""small arms"", half of them probably in africa? people kill people, you know.",5/06/2004 20:55
Talk:Arms industry,Propaganda, and so do bullets. —the preceding  comment was added by,28/03/2007 16:32
Talk:Arms industry,Article expansion,"i work in security assistance in dealing with foreign military sales (fms), and have attended class at the defense institute for security assistance management (disam), but that doesn't make me an expert yet.  it really is a complex organization with stringent directives, much of which is outlined in the secretary of defense instruction titled (currently) ''joint security assistance training manual'' (jsat), and the soon to be completed jset which will replace the jsat.  let's face it, the world is not a safe place.  there are many reasons that we share our weapons, technology and practices (training) with other countries.  we share this with our allies to ensure that if and when we go into battle with them, we may have a better coordinated fight.  we give things to other countries as a gesture of good will.  another very important part that is commonly overlooked is that when international military students come to the u.s. to train, they get to see the u.s. for what it really is, and can take their (hopefully pleasant) experiences home with them to share with their friends and families.  since it is not uncommon for a  have served in their nations military, there is a chance that they may have attended training in the u.s.  this is in fact the case with king  of .  another thing to be looked at is countries that we may have obligations (under treaties) to defend, such is the case with  and the  (south korea).  if they purchase our technology (and the training to use it), it may partially relieve our responsibilities.  however, this article surely needs to be expanded.  foreign military sales (fms) is extremely important.  there should be separate articles for fms, imet, dcs, disam, international military student officer (imso) (my job), naval education and training security assistance field activity (netsafa), u.s. army security assistance training field activity (satfa), air force security assistance center (afsac), security assistance officer (sao) among others.  i would love to help write these articles, but i'm not an article writer.  i can help with facts, perhaps specific statistics, but i could not do it by myself.--",21/11/2005 4:09
Talk:Arms industry,Article expansion," ""let's face it, the world is not a safe place.""  largely because the american arms industry is behind every war since david copperfield was a kid. —the preceding  comment was added by",28/03/2007 16:33
Talk:Arms industry,Article expansion," i have tried to do research on this topic, and i have added several paragraphs. i am, however, quite new to wikipedia, and therefore apologize for my numerous meaningless edits (i will try to update by doing one big update in the future). if you discover that any of the information is uncertain, or that it is not properly organized, feel free to work over my own edits. i consider this topic to be important, and will therefore do whatever i can to improve this article, more research on this topic will be completed soon. --",21/12/2005 6:46
Talk:Arms industry,Article expansion,"information on arms trade is hard to obtain. not only illegal but also legal military transactions are often taking place in secret. help improve and bring attention to the article. —preceding ] • ) 0657, 21 december 2005   ''information wanted'' need some info on the weapons industry of '''france''', '''britain''' and '''russia'''.—preceding ] • ) 1748, 22 december 2005    please add methods of terrorits groups like lra (lords resistance army)obtaining weapons.  —preceding ]",13/03/2009 23:13
Talk:Arms industry,Contradiction (since removed),"the values in the top arms exporters table seems to be completely wrong.  the total of the top arms exporters for 2006 is $1.2billion, whereas the article also states ""from 1989 to 1996, the global value of direct commercial arms sales was us$257 billion, of which 45% was exported from the us"".  ($257/8 years  $32b/year, so unless the arms trade dropped by a factor of 25 in the next decade, those numbers are incorrect.)  the cited sources also give different values.  i added the contradiction flag at the top of the article, and added a sentence above the table telling people to go to the sources instead.  i don't know what the wiki-appropriate edit should have been, but i assume that this article is sufficiently watched that someone will be aroudn shortly to clean it up.  thank you.    the 'top arms exporters' table is now gone, so i removed the contradiction flag.  i clarified that the table that replaced it excludes china (see the cited references.)  an accurate and complete breakdown of arms traffic (npov, of course) would be a useful addition to this page.",22/04/2007 4:01
Talk:Arms industry,Contradiction (since removed),"""world's largest arms exporters"" seems to be missing countries? for what i know, turkey should be in that list, as according to sectoral information from 2008, its exports exceeded 500 million dollars !?! claricication please.  — preceding ] • )",6/01/2011 15:36
Talk:Arms industry,Invalid criticism of the United States,"a large part of this piece seems to be an attempt to slander the united states and does not objectively look at arms sales worldwide. no mention is made of other major arms exporters in the same light... small arms exports are mentioned, but based on the article one would think that the united states is the primary supplier of small arms, when in fact it is russia (whose ak-47 is the most widely produced assault weapon). i recommend that arms sales specifically related to the united states be moved to a new article titled, ""arms sales of the united states,"" and then that article broken down into sections where criticisms such as the ones that exist in this article can be put into proper context.  let's get it straight and speak only the truth.  what make people hate the states?  here is an example.  tell me what is wrong with this [ harold pinter the nobel prize in literature 2005]  and then there's this ""the united states is by far the largest exporter of weapons in the world, with a sales volume that exceeds the next 14 countries combined. military sales equate to about 18 percent of the federal budget, far and away the greatest proportion of any nation."" this is ridiculous! 18% of the $2.2 trillion federal budget (fy 2006) is $396 billion, yet according to sipri total arms sales worldwide totalled a maximum of $53 billion for 2004, with the united states making up approx. half of that.  ""according to the 2005 annual us congress reports, 58% of all us arms trade contracts are made with developing countries."" this is especially misleading, because nowhere in the article does it cite that russia is the largest exporter of arms to the developing world. (source cdi, ""u.s. arms still dominate international market, russia leader to developing world"" nov 15, 2006)  in summary, it seems that the intention of this article is to slander the united states by misleading the reader by using an extremely selective use of sources and ""facts"" that do not hold up to any kind of scrutiny. i recommend the united states be removed from this article entirely and be given its own entry. —the preceding  comment was added by",19/02/2007 8:46
Talk:Arms industry,Invalid criticism of the United States,"in fact the world won't be save while people like you still live.  you're not happy with what you named ""extremely selective use of sources"", and you make me wonder how in the world there are so many people, mainly in the states, so stupid and brainwashed like you.  it's really disturbing and i can see that more 2 or 3 right-wing administrations like reagan and bush, oil and arms industries puppets, will lead your country to civil war.  for as you know, fortunately there are also human beings left in your country that will not stand more of your worldwide misery and lies.  -  this clause seems wholly unsupported ""entire nations, to use the parlance of the early 21st century, can go from the ""coalition of the willing"" to the ""axis of evil"" in very little time, and every change affects policy and the distribution of arms in the world.""",15/03/2007 17:06
Talk:Arms industry,Invalid criticism of the United States," are you brainwashed or just plain stupid?  have a look in the east, mainly near east, american foreign police in the last 50 years history.  how many times your enemies changed their names, how many times the same former enemies changed to big friends of yours? —the preceding  comment was added by",28/03/2007 16:47
Talk:Arms industry,Invalid criticism of the United States,"there is a better way of describing this process than using terms directed specifically at slandering the us.  that sentence and the following  """"freedom fighters"" become ""insurgents"". ""terrorists"" become ""invaluable allies"", and ""religious zealots"" morph into ""agents of stability"". entire nations, to use the parlance of the early 21st century, can go from the ""coalition of the willing"" to the ""axis of evil"" in very little time, and every change affects policy and the distribution of arms in the world.""  are very much directed specifically at the us when many other nations have gone through the same process.  should be put in an objective manner, not like it is, currently.",7/04/2007 3:57
Talk:Arms industry,Invalid criticism of the United States,"shut up and accept the facts. u.s.  evil. the cold hard facts, christ.  -g  ""of course—and this is endemic of nearly every debate over arms trade—the terminology used and the people it refers to can be frustratingly fluid. as years pass, governments decide on new ""interests"" and circumstances change accordingly. ""freedom fighters"" become ""insurgents"". ""terrorists"" become ""invaluable allies"", and ""religious zealots"" morph into ""agents of stability"". entire nations, to use the parlance of the early 21st century, can go from the ""coalition of the willing"" to the ""axis of evil"" in very little time, and every change affects policy and the distribution of arms in the world.""  i removed that^. it is obviously written by someone with a bias against the us, and anyone that cannot see it is either blind, a fool, or both. ""coalition of the willing"" and ""axis of evil"" being two terms used by the bush administration and seem to criticize such beliefs. also personal opinions are personal opinions, and are discouraged on wikipedia when it comes to making a case for or against. in addition, they are quotes without any reference.  ""entire nations, to use the parlance of the early 21st century, can go from the ""coalition of the willing"" to the ""axis of evil"" in very little time,"" has no source to back it up. who says that it can go from one to the other in very little time. let's be honest here. this is a slam against the usa and if we take it as that, it is factually incorrect on account that the ""axis of evil"" included north korea and the united state's relations with north korea have pretty clear since the korean war. when were they ever part of the ""coalition of the willing""?",19/09/2009 1:13
Talk:Arms industry,Statistical support,"the volume of transactions for specific contries can vary a lot from year to year and comments about the volume for a single year could be misleading and become irrelevent in the future.  many statistical figures originally contained in this article come from this annual crs report to congress [ conventional arms transfers to developing nations, 1997-2004] however, other figues originally contained in this article come from the appendices of the [ sipri yearbook 2005] which are producing quite a different picture even considering that they are stated in 1990 dollars. --",16/04/2006 4:39
Talk:Arms industry,Statistical support," pov  i've tried to npov this article a bit, removing weasel phrases such as ''there are often allegations of political corruption in regard to large arms contracts.'' i'm sure there are, but without further context or citations (of wide spread practice, not individual incidents), it is imo a pov statement.  also removed the bit about how many people get killed by guns, which doesn't belong in the article, as well as the misunderstanding of both irony and the role of the security council.  an account of the oposition to arm trade aught to be in the article, but the article should not be an outlet for their ideas. --",23/01/2006 10:26
Talk:Arms industry,Major Weapon manufacturers,"is it really necessary to have a list of the major weapon manufacturing companies in the world, considering there's already an article for that (see )? at least, i'd try to shorten it, clarify it, maybe put it into some table. i've made some research and it seems most of sources i stumble upon are very subjective and unreliable. this article will be hard to complete. --",10/02/2006 3:03
Talk:Arms industry,Largest Weapons Exporters,"i created a table for the data listed here.  i don't know how to right justify the figures, so if somebody could do that i would appreciate it.  also, if the original author (or somebody) could clarify what they mean by ""current us dollars"" and ""1990 us dollars"", that would really help the understandability of the article.",6/06/2006 2:55
Talk:Arms industry,Largest Weapons Exporters,"the carlyle group is a private equity company and does not manufacture arms.  can someone please cite the original source for this table and give units to the numbers on the table?  ""us (1990-2006) 45438"" is an impressive number, and much bigger than any other number on the table, yet i'm forced to ask myself, ""45438 of what?""",23/11/2007 19:48
Talk:Arms industry,Lacking in history,"this article could use a ""history"" section, if anyone's willing to do the research to write it.",23/09/2006 1:40
Talk:Arms industry,AK-47 and Other Misunderstandings,"the  is the most widely-copied weapon in the world and, according to the russians, who would very much like a larger piece of the action, most are made illegally by nations and private enterprises which don't pay a license fee to the russian patent holder. so equating numbers of ak-47s with any sort of russian dominance seems hasty at best. even with developing countries, more than two thirds of russian transfers were to china and india, economic powerhouses in their own right and major military and nuclear powers besides. is it fair to equate these two nations with countries such as uganda or nigeria?  moreover, russian exports are steadily declining, and eu and israeli exports increasing, so statistics given for a range of years, especially in the past, may misstate the instantaneous, or even annual figures for the countries mentioned. see the current sipri report, among others.  it's also hard to equate the numbers released by the various agencies cited in both the main article and in these comments with reality, since terms of art, apples and oranges comparisons, and outright obfuscation mar most of them. sales to developing nations are not the same as the arms trade in its entirety, since a large part of us output, for example, goes to developed countries. canada, for example, buys from us, as do taiwan, australia, and many others, and all the official reports very clearly state that they reveal only unclassified information, so we must suppose that cia-mediated and other clandestine transfers don't show up in the statistics. in the end, the article relies on the informed guesswork of sipri and other organizations with somewhat less of an agenda and/or political mandate than many official government agencies.  the sipri report cited is actually last year's edition, and has been superceded by the 2006 version here [  sipri yearbook 2006]  [ l-3 communications] makes the sighting systems for weapons, as well as logistical support systems for military operations, so excluding it from the list, in this era of subcontractors taking on tiny bits of each finished product, seems slightly obsessive. one could easily carry this to extremes, and exclude the manufacturers of explosives, for example, because they have to be packed into a bomb in order to qualify as a weapon, or bullets, because they don't become weapons of war until fired from a gun at another human being. indeed, there are those who use ak-47s to hunt deer and other game, so perhaps many of these so-called assault rifles are actually intended for jolly bands of huntsmen, out to shoot ducks or quail.  likewise  profits from or substantially owns several defense companies. are the owners of a business somehow not responsible for what they produce? even if the relative amount of carlyle capital invested in weapons contractors is minor? one notes that aerospace & defense are specialties, while plowshares are not. not much money in the latter, one must suppose.",26/02/2007 14:31
Talk:Arms industry,AK-47 and Other Misunderstandings,"mikhail kalashnikov never patented the design for the ak47, hence until 1999 there was nothing illegal about other nations building their own versions or even exact copies.  izh's claim to the patent, issued 52 years after the rifle was first created, is incredibly dubious.  just a little titbit which might be of interest.",3/03/2007 17:31
Talk:Arms industry,Table vandalism,"currently the stats are all incorrect.  i've reverted the section to a previous version. feel free to remove/revert the vandalism if you see it. thanks,",6/03/2007 11:45
Talk:Arms industry,Illegal vs. Legal Arms Trading,"there seems to be very little distinction between legitimate, legal arms trading and illegal weapons smuggling (which is what it should be called). this is important because small arms smuggling is usually the area of concern for most people concerned with current events in war-torn regions and is what ""arms trade"" means to a lot of people; whereas legitimate trading between, say, the us and mexico, is entirely different. —the preceding  comment was added by",13/03/2007 21:46
Talk:Arms industry,Outdated Figures,"according to more current figures from 2006, russia and france have taken over as the leading countries in arms dealing -- why is this not reflected in the article?????  here is the link to the article setting this out.   —the preceding  comment was added by",28/03/2007 18:35
Talk:Arms industry,First post ever,"this article seems to violate the npov rule badly, especially the last part of global impact.  while america's policies might be questionable, this is not the place to do it.  i'm shocked that this whole talk page hasn't turned into a flame war considering how vehement most editors are about keeping pov out of an article. —the preceding  comment was added by",30/03/2007 20:03
Talk:Arms industry,Overall Lack Of Quality,"the whole thing is awful. even the very first line ""the arms industry is a massive global industry."" someone needs to rewrite this to a professional standard; i'd do it myself, but i don't have a good enough understanding of the subject matter. ironically, i came here to learn more about it...  --",13/04/2007 15:04
Talk:Arms industry,US is not the largest exporter of arms,"how can this article say that the us is by far the largest exporter of arms when this position is, according to many sources, held by russia.  sources     2 june 2007   both sources are rather fishy (incompetent journalist irresposible blab apparently).  according to sipri data (and their numbers i take anyday over what ""borzopisci"" write), largest armes exporter '''is''' usa, with russia not far behind.   why are you giving a link that refers to 2005? it is now 2008 and the united kingdom is currently the largest exporter of armaments.  ~'bs detector'~ 15 november 2008  —preceding ]",15/11/2008 20:33
Talk:Arms industry,Huge bias,reading it and in the ethical dimension opions are everywhere. there so many in there that it makes me sick. it was obviously written by someone with a anti-war bias. changes should be made immediately.  —preceding ],28/05/2008 21:34
Talk:Arms industry,For anyone interested in truth.,"i won't bother correcting the article since truth is usually deleted and called 'vandalism'. however, for anyone interested in truth as opposed to propaganda you will find that the united kingdom is in fact the world's largest arms exporter. i include the following references.            etc etc.  ~bs detector~  14 november 2008  —preceding ]",14/11/2008 21:12
Talk:Arms industry,Defense budget error,"i know the defense budget for the us is nowhere near 12.11% of the country's gdp - closer to 5%, really.  and either the us figure of 987.5 billion is wrong, or the total for the world is wrong - just sum up the top several countries and the discrepancies become clear.  i'm not sure where to find a good source for this, so i won't try fixing it myself - but i thought i'd bring it up.",15/01/2009 23:29
Talk:Arms industry,Defense budget error,sorry - i thought i was signed in.,15/01/2009 23:31
Talk:Arms industry,Venezuela's Military Budget,"there was a note in the ""world's largest defence budgets"" where it said that venezuela budget was 50 to 80 billion usd, that's just impossible, check the cia factbook at  and there you have that venezuela military budget it's around 1.2% of its gdp, reaching as much as 4.5 billion usd  —preceding ]",14/02/2009 16:19
Talk:Arms industry,Venezuela's Military Budget,"/span>   the world's largest defense budgets section is rubbish i think. it was obviously vandalized by someone, in a meticulous and well-planned way, the section looks rather convincing to the layman after all. i'll edit it according to the """" page",18/03/2009 13:07
Talk:Arms industry,New Attempts at Politicizing,"i am dismayed to see some new edits that are injecting politics into this wiki-article.  what, pray tell, does ""small arms-conflicts"" mean?  clearly, this is a fabricated political term of art invented by hoplophobes. the statistic quoted from the oxfam report is meaningless.  no modern war is fought entirely with small arms.  statistically, most casualties are caused by aerial bombs, artillery shells, mortars, and rockets, not small arms.  there are no  ""small arms-conflicts"", but there are conflicts that include the use of small arms.   to assign the aggregate death toll to a weapons system that is in fact has a minority causal relationship, and then give a name attributing the deaths wholly to that system is intellectually dishonest, at best, and political strong-arming at worst. in the early 21st century, perhaps the only ""conflicts"" that take place entirely with small arms are fought by urban street gangs.  so, with a high degree of certainly, the cited annual death toll in the hundreds of thousands is specious.  unless or until a less blatantly-biased source can be cited, this politicized statistical detrius from the oxfam politicos should be removed from the article..",5/06/2009 4:30
Talk:Arms industry,New Attempts at Politicizing," if editors want to assert facts, they must provide citations.  otherwise, they  are just inserting personal opinions (pov) in articles and in talk pages, including opinions about oxfam as a source, name-calling (""hoplophobes"") and exaggerated generalizations.  wp does not care about editors' opinions; just cited facts.",5/06/2009 17:33
Talk:Arms industry,New Attempts at Politicizing,"you've side-stepped the key issue  there are no  ""small arms-conflicts"". that term is a politicized construct.  do a google search on the phrase ""small arms-conflicts"" and you will see that the alleged ""reference"" essentially invented the term.  how can you accuse me of injecting opinion into the article, when all that i'm trying to do is delete some unsubstantiated balderdash another editor inserted? to insert that sort of blatantly-biased pov into this article without balance or attribution of the origin of the phrase is irresponsible and most unwikilike.",9/06/2009 3:51
Talk:Arms industry,Trends,"sipri published data for 2008, a good summary is [ here]. have fun.",8/06/2009 10:58
Talk:Arms industry,Trends,please note that  has been indefinitely blocked as a sock puppet.[,12/06/2009 1:13
Talk:Arms industry,Pop culture,"i propose to remove the ""pop culture"" section; it doesn't add anything to the article.",14/09/2009 14:44
Talk:Arms industry,Pop culture," i agree with you. unless someone protests, i'll just remove it in some days.",13/01/2010 18:55
Talk:Arms industry,Wrong chart,and  have higher military spending than spain.,13/10/2009 23:13
Talk:Arms industry,[[Arms_exports#Ethical_dimension|Ethical dimension]] section,"this section reads like nothing more than editorialising and moralising, and can hardly be considered .",31/10/2009 3:43
